{
  "schema_version": 1,
  "packet_id": "weather-042-client",
  "task_id": "weather-042-client",
  "execution": {
    "orchestrator": {
      "adapter_id": "example.local-orchestrator",
      "run_id": "run-weather-042-client-001",
      "host": "worker-01",
      "workspace_ref": "workspace-weather-042-client",
      "session_ref": "session-001"
    },
    "agent": {
      "adapter_id": "example.command-agent",
      "agent_name": "implementation-agent",
      "model_provider": "provider-selected-at-runtime",
      "model": "model-selected-at-runtime",
      "agent_session_ref": "agent-session-001"
    },
    "started_at": "2026-07-28T00:00:00Z",
    "ended_at": "2026-07-28T00:08:00Z",
    "metadata": {
      "transport": "local-process"
    }
  },
  "status": "complete",
  "summary": "Implemented the typed weather service client behind the existing interface and added isolated contract tests.",
  "changes": [
    {
      "repository": "application",
      "path": "src/weather/client/service-client.ts",
      "purpose": "Implement the service contract adapter."
    },
    {
      "repository": "application",
      "path": "tests/weather/client/service-client.test.ts",
      "purpose": "Cover successful, malformed, and unavailable service responses."
    }
  ],
  "contracts": {
    "provided": {
      "weather_client_v2": {
        "entrypoint": "src/weather/client/service-client.ts",
        "interface": "WeatherClient"
      }
    },
    "changed": []
  },
  "validation": [
    {
      "check": "Project-defined weather client test target",
      "result": "passed",
      "details": "All client contract cases passed.",
      "count": 12
    }
  ],
  "decisions": [
    "Kept transport mapping behind the existing WeatherClient interface."
  ],
  "risks": [
    "Live service integration was outside this packet's network-forbidden policy."
  ],
  "artifacts": [],
  "context_used": [
    "weather.client-contract"
  ],
  "context_requested": []
}
